,Name,new_lang,ISBN,Geocode,Adress,description
595,The Colour of Radio: Essays and Interviews. Peter Redgrove,en,1905024150,"52.08446, 5.168630000000007",Padualaan 99 Utrecht,peter redgrove prolific poet indefatigable writer prose imaginative discursive he also extremely responsive articulate interviewee his imaginative prose fully represented volumes peter redgrove library collection essays interviews pieces reflect childhood education marriages poetry writing others especially important him passionate involvement science religion attempt forge world view integrated two neil roberts professor english literature university sheffield he written numerous books essays literature including the lover dreamer world the poetry peter redgrove narrative voice postwar poetry edited blackwell companion twentieth century poetry his latest book ted hughes a literary life peter redgrove 1932 2003 worked several interlinked fields poet novelist playwright psychological practice he believed creative psychological scientific work aspects common study insights profound illuminating constantly exciting he received many awards life especially honoured receiving queen s gold medal poetry 1996
596,The Chosen One,en,595131549,"52.08446, 5.168630000000007",Padualaan 99 Utrecht,the chosen one
597,Thai Spa Book: The Natural Asian Way to Health and Beauty,en,794600964,"52.0689552, 5.137240600000041",3524AK Utrecht,this guide soothing natural techniques traditional thai healing it contains easy to follow instructions recipes along 150 photographs shot entirely thailand country s top supermodels
598,Thailand's Luxury Spas: Pampering Yourself in Paradise,en,794603416,"52.0689552, 5.137240600000041",3524AK Utrecht,i thailand s luxury spas i presents best spa options available thailand detailed easy to follow recipes many traditional thai healing therapies pamper comfort privacy home br br massage meditation restorative beauty treatments pick me up tonics tone me down baths all outlined simple instructions clear color photographs i thailand s luxury spas i focuses stress busting therapies run gamut various forms thai massage meditation full body beauty treatments facials relaxing baths scrubs healthy tonics much more practical tips given recreate many recipes home specific treatments outlined specific ailments br br superb full color photography featuring many top supermodels shot entirely location thailand s super deluxe spas enjoy true thai style chill out spa experience wherever live i thailand s luxury spas i
599,"Who Said ""Sweet Sixteen""?",en,449700461,"52.0689552, 5.137240600000041",3524AK Utrecht,who said sweet sixteen
600,"Sweet Maria's Cookie Jar: 100 Favorite, Essential Recipes for Everyone Who Loves Cookies",en,312284950,"52.0689552, 5.137240600000041",3524AK Utrecht,for sweet snack delectable dessert maria bruscino sanchez baker author three previous cookbooks offers cookie collection family recipes popular bakery treats classics variations familiar favorites br br cookies cookie lovers come shapes sizes tastes book something everyone including cappuccino drops cheesecake squares amaretto biscotti chocolate nutella sandwiches italian love knots classic chocolate chip selection low fat low sugar gluten free cookie recipes complete information ingredients kitchen equipment well baking tips techniques collection easy make recipes sure produce tasty results br br whether like cookies dropped rolled filled piped fried i sweet maria s cookie jar i recipe looking for thrilled discover br
601,Prairie Fire,en,595433987,"52.0689552, 5.137240600000041",3524AK Utrecht,gripping compelling populist novel 21st century author new upton sinclair with excitement james bond thriller novel takes reader wheat fields kansas bedrooms international banking system meanwhile involving world s stock exchanges commodities market massive world drug trade intelligence community presidential campaign while novel fresh morning paper find there this well informed deep background set objective fact rapidly diminishing world grain reserves climate change peak oil wm h ktke author the final empire
602,No Cause For Indictment: An Autopsy of Newark,en,1933633212,"52.0689552, 5.137240600000041",3524AK Utrecht,the definitive account buildup chaos aftermath one worst urban riots us history 1967 newark riots being re issued fortieth anniversary devastating event i no cause for indictment i is must read understand issues still facing urban america poverty political corruption racism br br forty years ago newark s oppressed black majority erupted revolt ruthlessly put police national guard units when reporters afraid ronald porambo walked streets newark took four years research write whole story its publication resulted two attempts life br br this edition includes introduction editor original manuscript tumult surrounding book s publication afterword interviewing author struggles faced publication
603,James Rosenquist Big Paintings,fr,847818454,"52.0689552, 5.137240600000041",3524AK Utrecht,james rosenquist big paintings
604,Awake Unto Me: Selected Poems,en,595668143,"52.0689552, 5.137240600000041",3524AK Utrecht,running in evening i ve run breath gone away br rising winds disturb forbidding sands br cacti rustle close day br blackened forms directions stand br my eyes dazed shimmering heat br lemon gusts sage dry nose br i look around evening like sheet br darkened blue moonless blackness grows br a windless rustle eerily crawls away br horizons always past sight br i can t sure now what come way br could wind or something night br and darkness chills sun burned skin br i sense desert slowly closing in
605,"Acuicultura: Produccion, Comercio y Trazabilidad",es,8497450914,"52.0689552, 5.137240600000041",3524AK Utrecht,la acuicultura como actividad emergente productora de nuevas especies aptas para el consumo humano para servir de suministro otras actividades muestra en la actualidad una tendencia creciente consolidada de amplias perspectivas de futuro los productos pesqueros cultivados en las instalaciones acucolas controlados por el hombre sometidos mejoras en la produccin podrn sustituir en parte las capturas de peces efectuadas por las embarcaciones que faenan en los ocanos el crecimiento espectacular de la acuicultura marina es reciente ya est consolidado este libro trata de dar cuenta de los factores clave como pueden ser el estudio de los determinantes de la emergencia de esta actividad los marcos normativos los arbitrajes existentes la hora de evaluar aquellos rasgos referidos los derechos de propiedad de las instalaciones marinas la complementariedad de los usos los posibles conflictos derivados de los mismos asimismo se describen los aspectos comerciales analizando los niveles de especializacin en este volumen se destaca el papel trascendental que juega la trazabilidad en el campo de los productos bsicos alimentarios con normativas internacionales comunitarias nacionales cada vez ms frecuentes la experiencia de la empresa isidro de la cal constituye una referencia obligada un caso ejemplar en el campo de la acuicultura solamente por ser una de las empresas pioneras en este sector sino por abarcar la integracin de varias actividades conexas que aumentan el grado de valorizacin de los productos cultivados
606,Tumors of Soft Tissue: Based on the Proceedings of the 52nd Annual Anatomic Pathology Slide Seminar of the American Society of Clinical Pathologists,en,891892532,"52.0689552, 5.137240600000041",3524AK Utrecht,here s ideal reference diagnosis tumors skeletal muscles connective tissue fat related structures no textbook matches scope depth coverage complex challenging area surgical pathology text contains much practical information differential diagnosis throughout microscopic findings correlated latest developments molecular biology cytogenetics immunohistochemistry provide comprehensive integrated approach evaluation diagnosis almost 2 000 superb illustrations capture appearance complete range entities help relate specific classifications the result essential resource diagnose treat soft tissue tumors
607,PR Fur Dummies,de,3527700536,"52.0689552, 5.137240600000041",3524AK Utrecht,erfolgreiche public relations steht fur wir sind wer uns kennt man egal welcher branche ohne pr fehlt ihrer firma das tor zur offentlichkeit br das anschauliche buch pr fur dummies ersetzt ihnen eine zahe pr schulung denn mit dieser praktischen profi anleitung werden sie zum pr experten viele interessante beispiele aus der praxis helfen ihren ideen auf die sprunge sie lernen kreativ zu denken und das richtige pr konzept fur ihre strategie zu erstellen so wird ihre firma bald positiv aller munde sein
608,Epic Season: The 1948 American League Pennant Race,en,1558491473,"52.0689552, 5.137240600000041",3524AK Utrecht,this book recounts story one memorable seasons history major league baseball drawing interviews surviving participants well daily newspaper accounts david kaiser re creates drama 1948 american league pennant race places within broader historical context unfolding time baseball truly america s national pastime 48 season saw three teams vie championship always seemed within reach never assured in cleveland guidance maverick owner bill veeck charismatic player manager lou boudreau indians set new attendance records team included first black player american league larry doby perhaps famous pitcher never appeared major league game satchel paige in boston ted williams enhanced already fabled reputation another extraordinary season leading red sox team new manager joe mccarthy reshaped off season in new york defending champion yankees struggled repeat behind crippled joe dimaggio whose clutch hitting stretch enthralled baseball fans everywhere
609,Guinness World Records 2000,en,851120989,"52.0689552, 5.137240600000041",3524AK Utrecht,filled incredible feats records events ultimate authority every record world completely updated revised 2000 total 4 000 entries 200 categories
610,Norwegians in Minnesota,en,873514211,"52.0689552, 5.137240600000041",3524AK Utrecht,norwegian culture permeates state s character helps define minnesota s unique social political business environment authors qualey gjerde trace norwegian influence minnesota art culture politics community life
611,"From Peasants to Farmers: The Migration from Balestrand, Norway, to the Upper Middle West",en,521368227,"52.0689552, 5.137240600000041",3524AK Utrecht,this book examines trans atlantic chain migration norwegian fjord district settlements nineteenth century rural upper middle west considers social economic conditions experienced europe well immigrants cultural adaptations america
612,"Sweety Pies: An Uncommon Collection of Womanish Observations, with Pie",en,1561588482,"52.0689552, 5.137240600000041",3524AK Utrecht,women sharpen women i m convinced learn lot woman based feeds people loves woman s recipes especially prized recipes are revelation woman is thinks behaves values lives life br this collection 70 pie recipes gathered women author patty pinner s life family friends women part personal history what distinguishes book utterly beguiling storytelling each recipe accompanied story told woman known making pie sister baby s buttermilk pie miss hatfield her jelly pies it also filled truths handed mothers or wish handed mothers like an unhappy husband ask toasted snow you want man jealous nothing or everything this cookbook that s love life family friendship community much recipes
613,Karaoke Nights: An Ethnographic Rhapsody,en,759100470,"52.0689552, 5.137240600000041",3524AK Utrecht,karaoke the word conjures kinds visions_possible stardom abject performance terror head shaking bewilderment ten years ago japanese craze recently arrived u s rob drew drawn phenomenon subject research what discovered fascinate surprise you whether student popular culture curious what s going happen next saturday get sing first song corner bar karaoke nights keen observation external behavior deejays performers audience intimate portrait emotional roller coaster internal life karaoke singer drew lets feel itos like performer_agonizing song feeling nervous anticipation analyzing performance at time provides probing analysis varied roles karaoke plays popular culture guide understanding olocal musico relationship ordinary people stardom
614,Rhapsody,en,1583140638,"52.0689552, 5.137240600000041",3524AK Utrecht,rhapsody felicia mason released dec 24 1999 available purchase
615,FURNACE HARBOR: A Rhapsody of the North Country. Poems,en,252060032,"52.0689552, 5.137240600000041",3524AK Utrecht,furnace harbor a rhapsody north country poems
616,Romanian Rhapsodies Nos. 1 and 2 in Full Score,en,486408566,"52.0689552, 5.137240600000041",3524AK Utrecht,this convenient compilation 2 enescu works reproduced authoritative sources consists pair rhapsodies melodramatic gypsy mode performance staples around world the better known i rhapsody no 1 i tuneful wild i rhapsody no 2 i quieter darker sentimental br
617,"Confronting the Cow: A Young Family's Struggle with Breast Cancer, Loss & Rebuilding",en,967963796,"52.0689552, 5.137240600000041",3524AK Utrecht,confronting cow a young family s struggle breast cancer loss rebuilding
618,Floating Islands: A Global Bibliography,en,975542400,"52.0689552, 5.137240600000041",3524AK Utrecht,this book unique treasury information one nature s marvels floating islands it bibliography contains 1 500 citations books articles 20 languages subject the entries annotated cross referenced thematic geographic indices all aspects floating islands addressed
619,The Puppeteers: Studies of Obsessive Control,en,880641606,"52.0689552, 5.137240600000041",3524AK Utrecht,dr alper relates analyzes three cases come practice psychotherapist all three cases represent important aspects society texture lived experience matthew story precedes anticipates david koresh disaster waco texas becomes disciple counterculture cult searches higher mode life paul tries climb ladder success finds telemarketing sweatshop emily yearns romantic fulfillment gets caught trap obsessive love in final chapter alper weaves together common elements three stories pattern seduction manipulation obsessive control his arguments make shockingly clear behavioral puppetry merely occasional aberrant phenomenon read newspapers runs nearly every stratum society
620,Passport to Freedom,en,1412009448,"52.0689552, 5.137240600000041",3524AK Utrecht,an autobiographical collage book provides insight life saradha second generation indian immigrant girl living england in final analysis undoubtedly uplifting inspirational tale chronicles personal victories odds
621,Global Risk Based Capital Regulations,en,155623791X,"52.0689552, 5.137240600000041",3524AK Utrecht,are current risk based regulations designed basle committee banking regulations supervisory practices 1988 strenghtening international banking system making equal or regulations simply raising cost capital this book offers rigorous insights princeton international finance professor ethan kapstein washington d c attorney thomas stanton bank england s andrew bailey kemper financial chief economist david hale many others
622,El largo atardecer del caminante,es,9500412195,"52.0689552, 5.137240600000041",3524AK Utrecht,abel posse recrea en esta novela el destino secreto de uno de los hombres mas extraor dinarios de la conquista espanola a pie desnudo como un indio sin cruces ni evangelios alvar nunez cabeza de vaca se lanzo la caminata mas descomunal de la historia ocho mil kilometros traves de lo desconocido de la florida texas hasta mexico fue el ver dadero descubridor de los estados unidos de regreso espana fue nombrado adelan tado gobernador del rio de la plata en paraguay lucho contra la poligamia la escla vitud de los indios lo devolvieron espana en cadenas viejo arruinado pero vencido escribe en sevilla una version secreta de su odisea de su intima experiencia de america pero entre los renglones del recuerdo vuel ve filtrarse la vida real con su llamado de amor su amenaza de muerte pasado presente se conjugan para un dramatico sorprendente desenlace en abel posse hay mucho talento mucha sabiduria mucha literatura yo soy quien para decirselo nadie pero si lo soy para pensarlo en voz alta camilo jose cela premio novel de literatura posse ha extendido la novela de una nueva manera fluida sutil desmontando el tiempo como alejo carpentier rearmando las piezas en formas nuevas e interesantes alan ryan the washington post la recreacion tiene tal fuerza sortea con tanta eficacia los inevitables anacronismos emplea con una conviccion aun mayor los estados de animo del relator un verdadero existencialista un tragico la manera de los grandes agonistas que el largo atardecer del caminante convence en igual medida oscar hermes villordo la nacion aunque abel posse escriba en prosa el sentido de ritmos tiempos que vacomponiendo asi como el color el calor de su discurso ponen en evidencia al artista que subyace en este narrador la plasticidad pictorica musical de sus textos raul h castagnino la prensa
623,A Passion for the Past: Creative Teaching of U.S. History,en,325000611,"52.0689552, 5.137240600000041",3524AK Utrecht,james percoco challenges venture beyond history textbook provide students opportunities experience history firsthand he demonstrates how using applied history bring life people places events nation s history inspiring students passion past br br join percoco students embark calls academic adventures taking advantage many resources surrounding community beyond percoco s students travel historic sites exhibits examine archives primary source documents analyze movies documentaries conduct interviews create sculptures much more throughout book percoco lists numerous sources historical information documents well practical suggestions cultivating contacts managing logistics br br as result tangible experiences applied history offers students come appreciate relevance past present future as work make sense past learn question assumptions think critically ultimately develop personal yet valid understanding nation s history
624,"Claymore: Kindred of Paradise (Claymore, #11)",en,4088742818,"52.0689552, 5.137240600000041",3524AK Utrecht,in northern town pieta clare force claymores battle troupe awakened ones prevent advancing south their orders hold evil horde costs organization prepares secret weapon clare comrades realize suicide mission as friends fall one one warriors band together make last stand p p
625,Principles of Developmental Biology,en,393974308,"52.0689552, 5.137240600000041",3524AK Utrecht,designed one semester undergraduate course principles developmental biology stresses fundamental concepts select number instructive experiments cases contemporary research historical context
626,My Written Thoughts,en,1424184908,"52.0689552, 5.137240600000041",3524AK Utrecht,inside book collection poetry i written period four half years my book specific theme every poem different touches different subjects there poems personal talk i life i feel certain family members
627,"Comment se sortir d'une poupée gonflable et de beaucoup d'autres ennuis encore (Wilt, #1)",fr,2264011092,"52.0689552, 5.137240600000041",3524AK Utrecht,henry wilt est à bout la quarantaine passée chaque jour lui rappelle sa médiocrité une carrière au point mort des étudiants dégénérés et eva sa femme qui ne rate jamais une occasion de le rabaisser certain que le monde lui refuse depuis longtemps une gloire bien méritée henry décide d agir et de supprimer celle qui fait de sa vie un véritable enfer
628,"Wilt 2, ou, Comment se débarrasser d'un crocodile, de terroristes et d'une jeune fille au pair",en,2264011106,"52.0689552, 5.137240600000041",3524AK Utrecht,in this second chronicles henry wilt hero longer victim uncontrolled fantasies when wilt becomes unintentional participant terrorist siege forced find answer problems power corrupted greater men he
629,Maximum Velocity,ro,525942319,"52.0689552, 5.137240600000041",3524AK Utrecht,maximum velocity
630,Women Building Peace,en,1588265129,"52.0689552, 5.137240600000041",3524AK Utrecht,how women s contributions matter peace security processes why women s activities sphere explored separately peacebuilding efforts general decisively answering questions sanam anderlini offers comprehensive cross regional analysis women s peacebuilding initiatives around world highlights endemic problems stunt progress her astute analysis based extensive research field experience demonstrates gender sensitivity programming catalytic component complex task building sustainable peace provides concrete examples draw women s untapped potential
631,Peacebuilding: Women in International Perspective,en,041539791X,"52.0689552, 5.137240600000041",3524AK Utrecht,this book clarifies key ideas practices underlying peacebuilding understood broadly formal informal peace processes occur pre conflict conflict post conflict transformation br br applicable peacebuilders elisabeth porter highlights positive examples women s peacebuilding comparative international contexts she critically interrogates accepted entrenched dualisms prevent meaningful reconciliation also examining harm othering importance recognition inclusion tolerance drawing feminist ethics book develops politics compassion defends justice equality rights need restore victims dignity complex issues memory truth silence redress explored new ideas reconciliation embracing difference emerge br br many ideas challenge orthodox understandings peace the arguments developed demonstrate peacebuilding understood broadly current united nations orthodox usages women s activities conflict transitional societies valued participating building sustainable peace justice theoretically integrating peace conflict studies international relations political theory feminist ethics book focuses lessons learned best practices peacebuilding situated around un security council resolution 1325 women peace security br br em peacebuilding em will particular interest peace practitioners students researchers peace conflict studies international relations gender politics
632,Setting the Agenda for Global Peace: Conflict and Consensus Building,en,754619338,"52.0689552, 5.137240600000041",3524AK Utrecht,anna snyder provides detailed account challenges women representatives non governmental organizations ngos faced building bridges across diverse ethnic racial national regional ideological backgrounds 4th united nations un conference women this book traces process women s peace groups set agenda global policies area women armed conflict setting agenda global peace shows ngos use conflict develop transnational social movements build consensus around issues global concern using conference case study snyder finds three purposes social movement conflict contention arising policy development deep rooted historical conflict conflicts ngo network priorities drawing together feminist conflict resolution social movement theories comprehensive text analyzes large scale decision making processes ngos points towards future directions conflict resolution consensus building
633,El Gran Libro de los Tests,es,8484602176,"52.0689552, 5.137240600000041",3524AK Utrecht,el gran libro de los tests
634,"English Historical Syntax and Morphology: Selected Papers from 11 Icehl, Santiago de Compostela, 7-11 September 2000. Volume 1",en,158811192X,"52.0689552, 5.137240600000041",3524AK Utrecht,this volume offers selection papers eleventh international conference english historical linguistics held university santiago de compostela from rich programme over 130 papers given conference present twelve papers carefully selected reflect state current research fields english historical syntax morphology some issues discussed emergence viewpoint adverbials english german changes noun phrase structure 1650 present development progressive scots passivization composite predicates loss v2 effects information structure english acquisition modal syntax semantics english verb want use temporal adverbs attributive adjectives early modern period many articles tackle questions change use methodological tools like computerized corpora the theoretical frameworks adopted include among others grammaticalization theory dik s model functional grammar construction grammar government amp binding theory br
635,Fuentes Para la Historia del Opus Dei,es,8434412306,"52.0689552, 5.137240600000041",3524AK Utrecht,fuentes para la historia del opus dei
636,Gualta,ca,952450178,"52.0689552, 5.137240600000041",3524AK Utrecht,gualta
637,Indigenous Traditions and Ecology: The Interbeing of Cosmology and Community,en,945454279,"52.0689552, 5.137240600000041",3524AK Utrecht,a new perspective religions environment emerges collection the authors diverse group indigenous non native scholars environmental activists address compelling urgent questions facing indigenous communities struggle threats sovereignty increased market media globalization conservation endangered bioregions drawing attention pressures threatening indigenous peoples ways life volume describes modes resistance regeneration communities maintain spiritual balance larger cosmological forces creatively accommodating current environmental social economic political changes
638,Le Roman d'Oxford,fr,2869302665,"52.0689552, 5.137240600000041",3524AK Utrecht,venu enseigner la littérature espagnole dans un collège d oxford le narrateur se retrouve désorienté et désarçonné par le conflit interne entre plusieurs cultures et plusieurs personnages un roman éblouissant de virtuosité d ironie et d humour
