,Name,new_lang,ISBN,Geocode,Adress,description
0,De Spaanse sjaal: Een keuze uit de verhalen (BBLiterair) (Dutch Edition),nl,9789023430926,"52.0806428, 5.142996100000005",Laan van Minsweerd 129 -130 Utrecht,No description is available
1,Paris Secret,en,9781447280699,"52.0806428, 5.142996100000005",Laan van Minsweerd 129 -130 Utrecht,"BRAND NEW, Exactly same ISBN as listed, Please double check ISBN carefully before ordering."
2,A Time of Day,en,9781471329470,"52.0806428, 5.142996100000005",Laan van Minsweerd 129 -130 Utrecht,"From the creator of popular radio detective Paul Temple comes this exciting novelisation of the classic TV serial A Time of Day, read by Greg Wise. The six-part series A Time of Day entertained and intrigued TV audiences in 1957, who knew that a Francis Durbridge serial was a guarantee of twists, turns, and dramatic surprises. All these and more can be found in this thrilling tale of a mysterious disappearance and a race against time...Intelligent, wealthy and leisured, Lucy and Clive Freeman have decided that their marriage is breaking up. But their plans for divorce seem trivial when they receive some shocking news: their ten-year-old daughter Janet has vanished. She was last seen leaving school with a teacher, but since then there has been no trace of her. Has she been kidnapped? Is the motive money - or some other ransom? The Freemans must put aside their differences and join forces to rescue Janet - before it is too late..."
3,GIFHOUTEN BIJBEL,nl,9789035122680,"52.0806428, 5.142996100000005",Laan van Minsweerd 129 -130 Utrecht,No description is available
4,White Privilege: Essential Readings on the Other Side of Racism,en,9781429242202,"52.0806428, 5.142996100000005",Laan van Minsweerd 129 -130 Utrecht,<p>White Privilege is an exceptional anthology that expertly presents the significance and complexity of whiteness today while illuminating the nature of privilege and power in our society.
5,Islamic Theology: Traditionalism and Rationalism,en,9780748611027,"52.0806428, 5.142996100000005",Laan van Minsweerd 129 -130 Utrecht,"The principal theological struggle in Islam has taken place between traditionalist and rationalist theologians. Assessing materials from the 3rd/9th century to the 10th/16th century, Professor Abrahamov focuses on the foundations of both traditionalism and rationalism, the arguments which the two tendencies used against each other and the compromises reached. This is a ground-breaking study by a renowned scholar and writer."
6,Spectrum Machine Code Made Easy: For Advanced Programmers v. 2,en,9780907563440,"52.0806428, 5.142996100000005",Laan van Minsweerd 129 -130 Utrecht,No description is available
7,Vectorrekening en matrixrekening (Voortgezette wiskunde),nl,9789031305599,"52.0806428, 5.142996100000005",Laan van Minsweerd 129 -130 Utrecht,No description is available
8,Allen die gestorven zijn,nl,9789400500082,"52.0806428, 5.142996100000005",Laan van Minsweerd 129 -130 Utrecht,No description is available
9,De jonge professional: hulpmiddelen voor richting en groei,nl,9789082316209,"52.0806428, 5.142996100000005",Laan van Minsweerd 129 -130 Utrecht,No description is available
10,The Radiant Way,en,9780140101683,"52.0806428, 5.142996100000005",Laan van Minsweerd 129 -130 Utrecht,"Twenty five years ago Liz, Alix and Esther were leading lights at Cambridge. Now they meet as old friends at a glittering New Year's Eve party to welcome in the 1980s. It is the dawn of the Thatcher era, and Britain is on the brink of great social and political upheaval. How will these three ambitious and confident middle-aged women survive the personal and professional challenges, and the changing values of the next decade? The Radiant Way brilliantly explores their loves, losses, hopes and fears, and the strength of their friendship."
11,Een parel in Gods ogen,nl,9789020930504,"52.0806428, 5.142996100000005",Laan van Minsweerd 129 -130 Utrecht,No description is available
12,ELEMENTAIRE ECONOMIE 11E DR,nl,9789020718386,"52.0806428, 5.142996100000005",Laan van Minsweerd 129 -130 Utrecht,No description is available
13,De kraaien zullen het zeggen,nl,9789038849485,"52.0821527, 5.14310487901",Vossegatselaan 53 3583 RR Utrecht,No description is available
14,De vliegeraar (Dutch Edition),nl,9789023477327,"52.0821527, 5.14310487901",Vossegatselaan 53 3583 RR Utrecht,No description is available
15,"Het Verloren Paradijs, Stukje 2 (1792) (Dutch Edition)",nl,9781165335183,"52.0821527, 5.14310487901",Vossegatselaan 53 3583 RR Utrecht,"This scarce antiquarian book is a facsimile reprint of the original. Due to its age, it may contain imperfections such as marks, notations, marginalia and flawed pages. Because we believe this work is culturally important, we have made it available as part of our commitment for protecting, preserving, and promoting the world's literature in affordable, high quality, modern editions that are true to the original work."
16,Het andere eiland,nl,9789056721978,"52.0821527, 5.14310487901",Vossegatselaan 53 3583 RR Utrecht,No description is available
17,Mijn Ierse dochter,nan,9789044310757,"52.0821527, 5.14310487901",Vossegatselaan 53 3583 RR Utrecht,No description is available
18,Vader (Mijn strijd (Knausgard)) (Dutch Edition),nl,9789044517194,"52.0821527, 5.14310487901",Vossegatselaan 53 3583 RR Utrecht,No description is available
19,Een hart vol hommel(e)s (Dutch Edition),nl,9789402707205,"52.0821527, 5.14310487901",Vossegatselaan 53 3583 RR Utrecht,No description is available
20,Kiem: biografie van mijn jeugd,nl,9789045851723,"52.0821527, 5.14310487901",Vossegatselaan 53 3583 RR Utrecht,No description is available
21,De vuurtoren van Connemara,nl,9789022565094,"52.0821527, 5.14310487901",Vossegatselaan 53 3583 RR Utrecht,No description is available
22,Gebroken Vleugels: Take these broken wings and learn to fly again Learn to live so free,nl,9789055993611,"52.0821527, 5.14310487901",Vossegatselaan 53 3583 RR Utrecht,No description is available
23,De nachtwandelaar,nl,9789052266572,"52.0821527, 5.14310487901",Vossegatselaan 53 3583 RR Utrecht,No description is available
24,Verbonden: hechting & liefde,nl,9789089538758,"52.0845406, 5.145907299999976","Pieter Saenredamstraat 46, Utrecht",No description is available
25,Anton (Dutch Edition),nl,9789029088626,"52.0845406, 5.145907299999976","Pieter Saenredamstraat 46, Utrecht",No description is available
26,SIMON VESTDYK EN LAHRINGEN,nl,9789063220792,"52.0845406, 5.145907299999976","Pieter Saenredamstraat 46, Utrecht",No description is available
27,Meisje met negen pruiken,nl,9789044641639,"52.0845406, 5.145907299999976","Pieter Saenredamstraat 46, Utrecht",No description is available
28,Kookschrift van een kookgek 3 BRAAKHEKKE,nl,9789051215984,"52.0845406, 5.145907299999976","Pieter Saenredamstraat 46, Utrecht",No description is available
29,De schaduw van de wind (Het kerkhof der vergeten boeken),nl,9789056725198,"52.0845406, 5.145907299999976","Pieter Saenredamstraat 46, Utrecht",No description is available
30,WHITMAM AFFAIRE,nl,9789021837376,"52.0845406, 5.145907299999976","Pieter Saenredamstraat 46, Utrecht",No description is available
31,De verdwenen bedelarmband,nl,9789490374501,"52.0845406, 5.145907299999976","Pieter Saenredamstraat 46, Utrecht",No description is available
32,De valse belofte,nl,9789041408877,"52.0845406, 5.145907299999976","Pieter Saenredamstraat 46, Utrecht",No description is available
33,De maat genomen : topmannen langs de feministische meetlat,nl,9789063052287,"52.0845406, 5.145907299999976","Pieter Saenredamstraat 46, Utrecht",No description is available
34,In transit (Dutch Edition),nl,9789047707875,"52.0845406, 5.145907299999976","Pieter Saenredamstraat 46, Utrecht",No description is available
35,Philips: familie van ondernemers,nl,9789490920098,"52.0845406, 5.145907299999976","Pieter Saenredamstraat 46, Utrecht",No description is available
36,Naar huis,nl,9789022590430,"52.0845406, 5.145907299999976","Pieter Saenredamstraat 46, Utrecht",No description is available
37,De offerplaats,nl,9789021014708,"52.0845406, 5.145907299999976","Pieter Saenredamstraat 46, Utrecht",No description is available
38,"Career of Evil (A Cormoran Strike Novel, 3)",en,9780316486453,"52.0845406, 5.145907299999976","Pieter Saenredamstraat 46, Utrecht","<b>The #1 internationally bestselling series is soon to be a major TV series on HBO.</b> <br/>""The third--and best--novel in the engaging Cormoran Strike private detective series... [Galbraith has] invented a serial killer for the ages, one who chills us from the book's grim but riveting opening... This perfectly paced mystery is packed with surprises.""<i> - USA Today</i><i><br/></i>When a mysterious package is delivered to Robin Ellacott, she is horrified to discover that it contains a woman's severed leg. Her boss, private detective Cormoran Strike, is less surprised but no less alarmed. There are four people from his past who he thinks could be responsible--and Strike knows that any one of them is capable of sustained and unspeakable brutality.<br/>With the police focusing on one of the suspects, Strike and Robin delve into the dark and twisted worlds of the other three men. But as more horrendous acts occur, time is running out for the two of them..."
39,Vochtige streken,nl,9789023455325,"52.0845406, 5.145907299999976","Pieter Saenredamstraat 46, Utrecht",No description is available
40,Een nieuwe kans (Ploegsma kinder- & jeugdboeken),nl,9789021665320,"52.0845406, 5.145907299999976","Pieter Saenredamstraat 46, Utrecht",No description is available
41,Sprakeloos (De Wase trilogie),nl,9789044633412,"52.0845406, 5.145907299999976","Pieter Saenredamstraat 46, Utrecht",No description is available
42,Storm in juni,nl,9789044521696,"52.0845406, 5.145907299999976","Pieter Saenredamstraat 46, Utrecht",No description is available
43,Het lot van de familie Meijer,nl,9789056723606,"52.0845406, 5.145907299999976","Pieter Saenredamstraat 46, Utrecht",No description is available
44,Route du soleil (Dutch Edition),nl,9789400508477,"52.0845406, 5.145907299999976","Pieter Saenredamstraat 46, Utrecht",No description is available
45,"De stilte van de witte stad (Trilogie van de witte stad, 1)",nl,9789400511224,"52.0845406, 5.145907299999976","Pieter Saenredamstraat 46, Utrecht",No description is available
46,Tegendraads (Jack Reacher) (Dutch Edition),nl,9789024568956,"52.0845406, 5.145907299999976","Pieter Saenredamstraat 46, Utrecht",No description is available
47,"Veel vrouwen, af en toe een man (Dutch Edition)",nl,9789025409944,"52.0845406, 5.145907299999976","Pieter Saenredamstraat 46, Utrecht",/ 90 254 0994 6 / Dutch literature / Nederlands / Dutch / Néerlandais / Niederländisch / paperback / 13 x 20 cm / 157 .
48,ALLEMAAL PSYCHISCH (PK),nl,9789067661409,"52.0845406, 5.145907299999976","Pieter Saenredamstraat 46, Utrecht",No description is available
49,De Vlinderjager,nl,9789044920000,"52.0845406, 5.145907299999976","Pieter Saenredamstraat 46, Utrecht",Thriller - Een met veel vaart geschreven thriller met een door de Nazi's gestolen schilderij van Rembrandt en een geheimzinnige goudschat als inzet.
50,Een Romance,nan,9789061690207,"52.0845406, 5.145907299999976","Pieter Saenredamstraat 46, Utrecht",No description is available
51,Misery (Poema pocket),nl,9789024545490,"52.0873018, 5.1357689",Bankstraat 27 Utrecht,No description is available
52,The Complete Novels of Jane Austen (Leather-bound Classics),en,9781684129065,"52.0873018, 5.1357690",Bankstraat 27 Utrecht,"<b>This new, enhanced leather-bound edition includes all the completed novels of beloved author Jane Austen.</b><br/>  Jane Austens stories of clever women, elusive love, and social mores have struck a chord with millions of fans who consider her work compelling, heartwarming, and essential. Adapted time and again for screen and stage, these enduring classics remain as enjoyable as ever, and are the perfect addition to every home library. This collectors edition includes all six of Austens completed novels: <i>Sense and Sensibility</i>, <i>Pride and Prejudice</i>, <i>Mansfield Park</i>, <i>Emma</i>, <i>Northanger Abbey, </i><i>and </i><i>Persuasion</i>. New readers will be enchanted once they open the genuine leather cover, see the specially designed endpapers, and read these brilliant stories, while readers familiar with Austen's genius will enjoy the introduction from an acclaimed Austen scholar that provides background and context for the works theyve always loved."
53,De Gekrompene,nl,9789022935316,"52.0873018, 5.1357691",Bankstraat 27 Utrecht,No description is available
54,The Hunt for Red October,nl,9789022994351,"52.0873018, 5.1357693",Bankstraat 27 Utrecht,"The CIA and the Soviets are on the chase of a Soviet submarine through 4,000 miles of ocean. The officer of the Soviet's most valuable ballistic-missile sub is trying to defect to the U.S. It is a novel that will keep you on the end of your seat throughout. A true game of cat and mouse."
55,De bange mens: mijn zoektocht naar de bron van onze angsten,nl,9789045043685,"52.0873018, 5.1357697",Bankstraat 27 Utrecht,No description is available
56,Zemindar,en,9780552118095,"52.0873018, 5.1357699",Bankstraat 27 Utrecht,No description is available
57,SCHADUWEN GETHSEMANE ROSS/SJOWALL,nl,9789027456922,"52.0873018, 5.1357700",Bankstraat 27 Utrecht,No description is available
58,"Last Argument of Kings (The First Law Trilogy, 3)",en,9780316387408,"52.0873018, 5.1357702",Bankstraat 27 Utrecht,"<b>The final novel in the First Law Trilogy by<i> New York Times</i> bestseller Joe Abercrombie. </b> <b><br/></b>Logen Ninefingers might only have one more fight in him -- but it's going to be a big one. Battle rages across the North, the king of the Northmen still stands firm, and there's only one man who can stop him. His oldest friend, and his oldest enemy: it's time for the Bloody-Nine to come home. With too many masters and too little time, Superior Glokta is fighting a different kind of war. A secret struggle in which no one is safe, and no one can be trusted. As his days with a sword are far behind him, it's fortunate that he's deadly with his remaining weapons: blackmail, threats, and torture. Jezal dan Luthar has decided that winning glory is too painful an undertaking and turned his back on soldiering for a simple life with the woman he loves. But love can be painful too -- and glory has a nasty habit of creeping up on a man when he least expects it. The king of the Union lies on his deathbed, the peasants revolt, and the nobles scramble to steal his crown. No one believes that the shadow of war is about to fall across the heart of the Union. Only the First of the Magi can save the world, but there are risks. There is no risk more terrible, than to break the First Law..."
59,De diamant van Banjarmasin: Kinderboekenweekgeschenk 2020 (Kinderboekenweek 2020),nl,9789059655355,"52.0873018, 5.1357703",Bankstraat 27 Utrecht,No description is available
60,Van de zee naar de hemel: de culinaire odyssee van een Frans-Nederlandse chef-kok,nl,9789053339633,"52.0873018, 5.1357704",Bankstraat 27 Utrecht,No description is available
61,The Casual Vacancy,en,9780316228534,"52.0873018, 5.1357706",Bankstraat 27 Utrecht,"When Barry Fairbrother dies unexpectedly in his early forties, the little town of Pagford is left in shock. Pagford is, seemingly, an English idyll, with a cobbled market square and an ancient abbey, but what lies behind the pretty façade is a town at war. Rich at war with poor, teenagers at war with their parents, wives at war with their husbands, teachers at war with their pupils.... Pagford is not what it first seems. And the empty seat left by Barry on the towns council soon becomes the catalyst for the biggest war the town has yet seen. Who will triumph in an election fraught with passion, duplicity and unexpected revelations? Blackly comic, thought-provoking and constantly surprising, <i>The Casual Vacancy</i> is J.K. Rowlings first novel for adults."
62,Uit grootmoeders tijd (Dutch Edition),nl,9789075531039,"52.0873018, 5.1357707",Bankstraat 27 Utrecht,No description is available
63,De kip die over de soep vloog,nl,9789038894904,"52.0873018, 5.1357709",Bankstraat 27 Utrecht,No description is available
64,Taalbarrieres in de zorg: over tolkenbeleid en tolken met beleid,nl,9789023246244,"52.0873018, 5.1357710",Bankstraat 27 Utrecht,No description is available
65,Ik hoor muziek,nl,9789463045919,"52.0873018, 5.1357711",Bankstraat 27 Utrecht,No description is available
66,De juiste beslissingen nemen (In 30 minuten),nl,9789056411312,"52.0873018, 5.1357713",Bankstraat 27 Utrecht,No description is available
67,De diamant van Banjarmasin: Kinderboekenweekgeschenk 2020 (Kinderboekenweek 2020),nl,9789059655355,"52.0873018, 5.1357714",Bankstraat 27 Utrecht,No description is available
68,De scheids (Dutch Edition),nl,9789057596919,"52.0873018, 5.1357715",Bankstraat 27 Utrecht,No description is available
69,The Nest: A Novel,en,9781443464574,"52.0873018, 5.1357716",Bankstraat 27 Utrecht,No description is available
70,Spelen tot het donker wordt,nl,9789021414287,"52.0873018, 5.1357717",Bankstraat 27 Utrecht,No description is available
71,"ZO MOOI GEMAAKT: Een bewaarboekje voor jou, door jou, over jou (Dutch Edition)",nl,9789086011476,"52.0873018, 5.1357718",Bankstraat 27 Utrecht,No description is available
72,ELF SAMENZWEERDERS,nl,9789052267371,"52.0873018, 5.1357719",Bankstraat 27 Utrecht,No description is available
73,Wampie,nl,9789021490014,"52.0873018, 5.1357720",Bankstraat 27 Utrecht,No description is available
74,De glazen brug,nl,9789035131286,"52.0873018, 5.1357722",Bankstraat 27 Utrecht,No description is available
75,Rec.play,nl,9789000032303,"52.0873018, 5.1357724",Bankstraat 27 Utrecht,No description is available
76,Thraxas Book Ten: Thraxas and the Oracle (The Collected Thraxas),en,9781546574736,"52.0873018, 5.1357725",Bankstraat 27 Utrecht,"In the tenth book of the series, armies are gathering. It's time for Thraxas and Makri to march back towards Turai. Lisutaris is War Leader and she trusts Thraxas enough to make him her personal security officer. Captain Thraxas is given the difficult task of outwitting Deeziz the Unseen, the enemy's most powerful sorcerer. He could do with some help from Makri. Unfortunately Makri spends most of her time hiding from the Elf with whom she once had an unsatisfactory relationship. Thraxas is relieved to meet a few familiar faces, refugees from Turai, but as he tries to prevent Deeziz from ruining the war effort, he finds himself baffled, outmanoeuvred, and badly in need of beer."
77,Hannibal,nl,9789024547401,"52.0873018, 5.1357727",Bankstraat 27 Utrecht,No description is available
78,The Shining,en,9780307743657,"52.0873018, 5.1357728",Bankstraat 27 Utrecht,"<b>Before <i>Doctor Sleep, </i>there was <i>The Shining, </i>a classic of modern American horror from the undisputed master, Stephen King. </b><br/>Jack Torrances new job at the Overlook Hotel is the perfect chance for a fresh start. As the off-season caretaker at the atmospheric old hotel, hell have plenty of time to spend reconnecting with his family and working on his writing. But as the harsh winter weather sets in, the idyllic location feels ever more remote . . . and more sinister. And the only one to notice the strange and terrible forces gathering around the Overlook is Danny Torrance, a uniquely gifted five-year-old."
79,TUSSEN SCHEMER EN DAGERAAD,nl,9789024218035,"52.0873018, 5.1357731",Bankstraat 27 Utrecht,No description is available
80,Moll Flanders (Dutch Edition),nl,9789031501151,"52.0873018, 5.1357732",Bankstraat 27 Utrecht,No description is available
81,Elon Musk: hoe de topman van SpaceX en Tesla onze toekomst vormgeeft,nl,9789400507142,"52.0873018, 5.1357733",Bankstraat 27 Utrecht,No description is available
82,Wellink aan het woord,nl,9789023468585,"52.0873018, 5.1357734",Bankstraat 27 Utrecht,No description is available
83,My Dark Vanessa: A Novel,en,9780062976802,"52.0873018, 5.1357735",Bankstraat 27 Utrecht,"<p>A hard story to read and a harder one to put down . . . a well-constructed package of dynamite.Stephen King</strong>Exploring the psychological dynamics of the relationship between a precocious yet naïve teenage girl and her magnetic and manipulative teacher, a brilliant, all-consuming read that marks the explosive debut of an extraordinary new writer.</strong>2000. Bright, ambitious, and yearning for adulthood, fifteen-year-old Vanessa Wye becomes entangled in an affair with Jacob Strane, her magnetic and guileful forty-two-year-old English teacher. 2017. Amid the rising wave of allegations against powerful men, a reckoning is coming due. Strane has been accused of sexual abuse by a former student, who reaches out to Vanessa, and now Vanessa suddenly finds herself facing an impossible choice: remain silent, firm in the belief that her teenage self willingly engaged in this relationship, or redefine herself and the events of her past. But how can Vanessa reject her first love, the man who fundamentally transformed her and has been a persistent presence in her life? Is it possible that the man she loved as a teenagerand who professed to worship only hermay be far different from what she has always believed?Alternating between Vanessas present and her past, My Dark Vanessa juxtaposes memory and trauma with the breathless excitement of a teenage girl discovering the power her own body can wield. Thought-provoking and impossible to put down, this is a masterful portrayal of troubled adolescence and its repercussions that raises vital questions about agency, consent, complicity, and victimhood. Written with the haunting intimacy of The Girls and the creeping intensity of Room, My Dark Vanessa is an era-defining novel that brilliantly captures and reflects the shifting cultural mores transforming our relationships and society itself."
84,Mannen die vrouwen haten,nl,9789056723088,"52.0873018, 5.1357737",Bankstraat 27 Utrecht,Some shelf and edge wear. Creasing to cover and some pages. Pages are clean and binding is tight.
85,The Lighthouse,en,9780571355723,"52.0873018, 5.1357738",Bankstraat 27 Utrecht,No description is available
86,How to Be Single,en,9781471146633,"52.0873018, 5.1357739",Bankstraat 27 Utrecht,"It's the most annoying question and they just can't help asking you. You'll be asked it at family gatherings, particularly weddings. Men will ask you on first dates. Therapists will ask you over and over again. It's the question that has no good answer. It's the question that when people stop asking it, makes you feel even worse: WHY ARE YOU SINGLE? 'A DELICIOUS FEAST OF A FIRST NOVEL..."
87,De eetclub (Dutch Edition),nl,9789041424426,"52.0873018, 5.1357740",Bankstraat 27 Utrecht,"De eetclub (Dutch Edition) [paperback] Noort, Saskia [Mar 28, 2013] ..."
88,Total Yoga: A Step-by-Step Guide to Yoga at Home for Everybody,en,9780007612604,"52.0914583, 5.1315992",Nachtegaalstraat 61 Utrecht,"The perfect introduction to yoga, from a leading teacher who shows how yoga can benefit everyone, no matter what your level of fitness or suppleness."
89,Get Carter,en,9780749001216,"52.0914583, 5.1315993",Nachtegaalstraat 61 Utrecht,"Doncaster, and Jack Carter is home for a funeral - his brother's. Frank's car was found at the bottom of a cliff, with him inside. Jack thinks that Frank's death is suspicious, so he decides to talk to a few people. Frank was a mild man and did as he was told, but Jack's not a bit like that."
90,Game Theory: A Very Short Introduction,en,9780199218462,"52.0914583, 5.1315994",Nachtegaalstraat 61 Utrecht,"Games are everywhere: Drivers maneuvering in heavy traffic are playing a driving game. Bargain hunters bidding on eBay are playing an auctioning game. The supermarket's price for corn flakes is decided by playing an economic game. This Very Short Introduction offers a succinct tour of the fascinating world of game theory, a ground-breaking field that analyzes how to play games in a rational way. Ken Binmore, a renowned game theorist, explains the theory in a way that is both entertaining and non-mathematical yet also deeply insightful, revealing how game theory can shed light on everything from social gatherings, to ethical decision-making, to successful card-playing strategies, to calculating the sex ratio among bees. With mini-biographies of many fascinating, and occasionally eccentric, founders of the subject--including John Nash, subject of the movie A Beautiful Mind--this book offers a concise overview of a cutting-edge field that has seen spectacular successes in evolutionary biology and economics, and is beginning to revolutionize other disciplines from psychology to political science.About the Series:</strong> Oxford's Very Short Introductions</strong> offers concise and original introductions to a wide range of subjects--from Islam to Sociology, Politics to Classics, and Literary Theory to History. Not simply a textbook of definitions, each volume provides trenchant and provocative--yet always balanced and complete--discussions of the central issues in a given topic. Every Very Short Introduction gives a readable evolution of the subject in question, demonstrating how it has developed and influenced society. Whatever the area of study, whatever the topic that fascinates the reader, the series has a handy and affordable guide that will likely prove indispensable."
91,Europa volgens Maarten van Rossem,nl,9789046812860,"52.0914583, 5.1315995",Nachtegaalstraat 61 Utrecht,No description is available
92,IV,nl,9789057598180,"52.0914583, 5.1315996",Nachtegaalstraat 61 Utrecht,No description is available
